Afbeeldingen;Categorieën;Naam;Prijs;Beschrijving
https://www.coureurlocal.be/wp-content/uploads/2022/12/Propel-advanced-sl-0-300x300.png;Racefiets;Giant Propel Advanced SL 0;12 499,00;Deze nieuwe aeromachine is gemaakt voor alle belangrijke momenten in de koers. De Giant Propel Advanced SL 0 biedt meer aerodynamica, betere afstelbaarheid en meer kansen om te winnen.
https://www.coureurlocal.be/wp-content/uploads/2021/12/langma-advanced-pro-disc-0-di2-300x300.png;Racefiets;Liv Langma Advanced SL Disc;11 999,00;De Liv Langma Advanced SL Disc, die al favoriet is bij klimverslaafden en worldtour racers, is helemaal opnieuw ontworpen waardoor hij nog lichter en stijver is.
https://www.coureurlocal.be/wp-content/uploads/2022/12/Propel-advanced-sl-0-1-300x300.png;Racefiets;Giant TCR Advanced SL Disc 0;11 999,00;De nieuwste generatie van de fiets die al meer dan drie decennia toonaangevend is als het gaat om innovatie in de wielersport. De Giant TCR Advanced SL Disc is de ultieme allrounder voor iedereen die topprestaties wil neerzetten.
https://www.coureurlocal.be/wp-content/uploads/2023/01/stormguard-E-1-300x300.png;E-Mountainbike;Giant Stormguard E+ 1;8 299,00;Met de krachtige nieuwe motor, soepele vering, carbon riemaandrijving en unieke zwevende achterdrager is de nieuwe Giant Stormguard E+ dé SUV onder de e-bikes. Van praktisch dagelijks gebruik tot meerdaagse avonturen, je mogelijkheden zijn oneindig met deze machtige e-bike!
https://www.coureurlocal.be/wp-content/uploads/2022/12/propel-advanced-pro-0-AXS-1-300x300.png;Racefiets;Giant Propel Advanced Pro 0 AXS;6 999,00;Het nieuw ontworpen frame snijdt nog beter door de wind en is ook lichter dan de vorige generatie. Het resultaat? Een Giant Propel Advanced Pro 0 AXS met een racewinnende efficiëntie die bijzonder moeilijk te verslaan is.
https://www.coureurlocal.be/wp-content/uploads/2023/01/stormguard-E-2-300x300.png;E-Mountainbike;Giant Stormguard E+ 2;6 799,00;Met de krachtige nieuwe motor, soepele vering, carbon riemaandrijving en unieke zwevende achterdrager is de nieuwe Giant Stormguard E+ dé SUV onder de e-bikes. Van praktisch dagelijks gebruik tot meerdaagse avonturen, je mogelijkheden zijn oneindig met deze machtige e-bike!
https://www.coureurlocal.be/wp-content/uploads/2022/12/propel-advanced-pro-o-DI2-1-300x300.png;Racefiets;Giant Propel Advanced Pro 0 DI2;6 599,00;Het nieuw ontworpen frame snijdt nog beter door de wind en is ook lichter dan de vorige generatie. Het resultaat? Een Giant Propel Advanced Pro 0 DI2 met een racewinnende efficiëntie die bijzonder moeilijk te verslaan is.
https://www.coureurlocal.be/wp-content/uploads/2021/12/tcr-advanced-pro-o-disc-0-axs-300x300.png;Racefiets;Giant TCR Advanced Pro Disc 0 AXS;6 299,00;In het klimmen, sturen en dalen ervaar je de ongeëvenaarde prestaties van de Giant TCR Advanced Pro Disc. Dit model brengt het fietsen in zowel de bergen als op het vlakke naar een hoger niveau dankzij het lichte, stijve frame en de aero-vormige buizen.
https://www.coureurlocal.be/wp-content/uploads/2021/11/qwic-atlas-zwart-300x300.png;E-bike;QWIC Atlas Vario;5 699,00;Necessary cookies are absolutely essential for the website to function properly. This category only includes cookies that ensures basic functionalities and security features of the website. These cookies do not store any personal information.
https://www.coureurlocal.be/wp-content/uploads/2021/12/langma-advanced-pro-disc-0-axs-300x300.png;Racefiets;Liv Langma Advanced Pro Disc 0 AXS;5 999,00;Necessary cookies are absolutely essential for the website to function properly. This category only includes cookies that ensures basic functionalities and security features of the website. These cookies do not store any personal information.
https://www.coureurlocal.be/wp-content/uploads/2021/01/premium-q-MN8-Belt-300x300.png;E-bike;QWIC Premium Q MN8 belt;5 549,00;De QWIC Premium Q MN8 Belt is samengesteld uit de meest hoogwaardige componenten en een uniek design. De Premium Q heeft de stilste en krachtigste e-bike motor op de markt en een accu van maar liefst 756 Wh. De luxe e-bike komt als ‘Best koop’ uit de ADR Fietstest 2021: “Super fiets, mooi design, lichte trap, goede motorondersteuning”.
https://www.coureurlocal.be/wp-content/uploads/2020/05/premium-q_mn8belt_female_asphalt-black-300x300.png;E-bike;QWIC Premium Q MN8 belt;5 549,00;De QWIC Premium Q MN8 Belt is samengesteld uit de meest hoogwaardige componenten en een uniek design. De Premium Q heeft de stilste en krachtigste e-bike motor op de markt en een accu van maar liefst 756 Wh. De luxe e-bike komt als ‘Best koop’ uit de ADR Fietstest 2021: “Super fiets, mooi design, lichte trap, goede motorondersteuning”.
https://www.coureurlocal.be/wp-content/uploads/2021/12/langma-advanced-pro-disc-0-di2-300x300.png;Racefiets;Liv Langma Advanced Pro Disc 0 DI2;5 899,00;Necessary cookies are absolutely essential for the website to function properly. This category only includes cookies that ensures basic functionalities and security features of the website. These cookies do not store any personal information.
https://www.coureurlocal.be/wp-content/uploads/2021/12/tcr-advanced-pro-o-disc-0-di2-300x300.png;Racefiets;Giant TCR Advanced Pro Disc 0 DI2;5 899,00;In het klimmen, sturen en dalen ervaar je de ongeëvenaarde prestaties van de Giant TCR Advanced Pro Disc. Dit model brengt het fietsen in zowel de bergen als op het vlakke naar een hoger niveau dankzij het lichte, stijve frame en de aero-vormige buizen.
https://www.coureurlocal.be/wp-content/uploads/2020/11/enviliv-advanced-pro-0-disc-300x300.png;Racefiets;Liv Enviliv Advanced Pro 0 Disc 2021;5 799,00;De prachtige aerodynamische Liv EnviLiv Advanced Pro Disc heeft een Advanced-Grade composite frame en is ontworpen voor pittige en razendsnelle ritten. De ongelofelijke zijdelingse stijfheid van de voorvork en ongeëvenaarde remkracht van de aerodynamische schijfremmen zorgen voor uiterst nauwkeurig bochtengedrag en stabiliteit.
https://www.coureurlocal.be/wp-content/uploads/2021/11/qwic-atlas-dusty-road-300x300.png;E-bike;QWIC Atlas Derailleur;5 199,00;De QWIC Atlas Vario is ontwikkeld voor dagelijkse woon-werkverkeer en recreatief gebruik in avontuurlijke stijl. Naast het subliem QWIC design, is de Atlas uitsluitend opgebouwd met superieure componenten. De Atlas won daarmee ook de prestigieuze German Design Award 2022.
https://www.coureurlocal.be/wp-content/uploads/2021/12/revolt-advanced-pro-0-300x300.png;Gravel, Cross, Adventure;Giant Revolt Advanced Pro 0;5 599,00;Deze gloednieuwe gravelbike is lichter en soepeler en voelt zich thuis op gevarieerd terrein. De Giant Revolt Advanced Pro staat garant voor zeer efficiënte prestaties en biedt uitermate veel controle.
https://www.coureurlocal.be/wp-content/uploads/2022/12/devote-advanced-pro-300x300.png;Gravel, Cross, Adventure;Liv Devote Advanced Pro;5 599,00;De Liv Devote heeft, met zijn gestroomlijnd uiterlijk en comfort, precies wat nodig is om je avontuurlijke wensen te besterken.
https://www.coureurlocal.be/wp-content/uploads/2020/05/premium-q_mn8_female_fog-white-300x300.png;E-bike;QWIC Premium Q MN8;5 149,00;De QWIC Premium Q MN8 Belt is samengesteld uit de meest hoogwaardige componenten en een uniek design. De Premium Q heeft de stilste en krachtigste e-bike motor op de markt en een accu van maar liefst 756 Wh. De luxe e-bike komt als ‘Best koop’ uit de ADR Fietstest 2021: “Super fiets, mooi design, lichte trap, goede motorondersteuning”.
https://www.coureurlocal.be/wp-content/uploads/2021/11/xtc-advanced-SL-29-1-300x300.png;Mountainbike;Giant XTC Advanced SL 29 1;5 499,00;Licht, efficiënt en razendsnel! Als de beklimmingen stijl zijn en de snelheden hoog, dan is deze Giant XTC Advanced SL 29 het favoriete wapen van XC-professionals.
https://www.coureurlocal.be/wp-content/uploads/2021/11/defy-advanced-pro-1-300x300.png;Racefiets;Giant Defy Advanced pro 1;5 399,00;Deze lichtgewicht carbon endurance racer is alles wat je nodig hebt voor de meest uitdagende ritten.
https://www.coureurlocal.be/wp-content/uploads/2022/12/avail-advanced-pro-1-300x300.png;Racefiets;Liv Avail Advanced Pro 1;5 349,00;De Liv Avail Advanced is licht, comfortabel en specifiek ontworpen voor dames.
https://www.coureurlocal.be/wp-content/uploads/2022/12/tcr-advanced-pro-0-disc-DI2-3-300x300.png;Racefiets;Giant TCR Advanced Pro Disc 0 DI2;5 299,00;In het klimmen, sturen en dalen ervaar je de ongeëvenaarde prestaties van de Giant TCR Advanced Pro Disc. Dit model brengt het fietsen in zowel de bergen als op het vlakke naar een hoger niveau dankzij het lichte, stijve frame en de aero-vormige buizen.
https://www.coureurlocal.be/wp-content/uploads/2021/12/revolt-E-300x300.png;E-bike;Giant Revolt E+ 2;5 299,00;Rij over verharde wegen, onverhard en gravel op deze veelzijdige, soepel rijdende e-bike. Met een nieuwe Syncdrive pro-motor hoogwaardige aluminium frameset is de Giant Revolt E+ klaar voor elk avontuur!
https://www.coureurlocal.be/wp-content/uploads/2020/11/enviliv-advanced-pro-1-disc-300x300.png;Racefiets;Liv Enviliv Advanced Pro 1 Disc 2021;4 999,00;Necessary cookies are absolutely essential for the website to function properly. This category only includes cookies that ensures basic functionalities and security features of the website. These cookies do not store any personal information.
https://www.coureurlocal.be/wp-content/uploads/2019/01/MD11-speed-diamond-300x300.png;Elektrisch;QWIC Performance MD11 Speed Diamond;4 399,00;De QWIC Performance MD11 Speed is de allround speedbike! Hij is een alleskunner en heeft uitzonderlijke prestaties in heuvelachtige omgeving.
https://www.coureurlocal.be/wp-content/uploads/2019/01/MD11-speed-trapez-300x300.png;Elektrisch;QWIC Performance MD11 Speed Trapez;4 399,00;De QWIC Performance MD11 Speed is de allround speedbike! Hij is een alleskunner en heeft uitzonderlijke prestaties in heuvelachtige omgeving.
https://www.coureurlocal.be/wp-content/uploads/2022/12/propel-advanced-1-300x300.png;Racefiets;Giant Propel Advanced 1;4 799,00;Deze Giant Propel Advanced wegmachine is opnieuw ontworpen zodat jij kan winnen van de wind en je zo leiden tot de grootste overwinningen.
https://www.coureurlocal.be/wp-content/uploads/2023/01/mira-desert-copper-300x300.png;E-bike;QWIC Mira Tour;4 299,00;Met de krachtige motor, de betrouwbare riemaandrijving en het onmiskenbare QWIC-design voel je je de koning of koningin van het fietspad met deze QWIC Mira Tour.
https://www.coureurlocal.be/wp-content/uploads/2021/12/tcr-advanced-pro-disc-1-axs-300x300.png;Racefiets;Giant TCR Advanced Pro Disc 1 AXS;4 699,00;In het klimmen, sturen en dalen ervaar je de ongeëvenaarde prestaties van de Giant TCR Advanced Pro Disc. Dit model brengt het fietsen in zowel de bergen als op het vlakke naar een hoger niveau dankzij het lichte, stijve frame en de aero-vormige buizen.
https://www.coureurlocal.be/wp-content/uploads/2021/11/defy-advanced-pro-2-AXS-300x300.png;Racefiets;Giant Defy Advanced pro 2 AXS;4 699,00;Deze lichtgewicht carbon endurance racer is alles wat je nodig hebt voor de meest uitdagende ritten.
https://www.coureurlocal.be/wp-content/uploads/2021/11/xtc-advanced-29-1-300x300.png;Mountainbike;Giant XTC Advanced 29 1;4 499,00;Deze lichtgewicht carbon hardtail is een geweldige keuze voor razendsnelle XC ritten. Deze Giant XTC Advanced zorgt voor een responsieve rijkwaliteit en maximale efficiëntie op snelle, flowy singletracks.
https://www.coureurlocal.be/wp-content/uploads/2021/11/qwic-rd11-speed-matte-black-300x300.png;Elektrisch;QWIC Performance RD11 Speed Diamond;3 999,00;De combinatie van snelheid, design en sportiviteit maakt deze QWIC Performance RD11 Speed zeer geschikt voor het dagelijkse woon-werkverkeer. Extreem hoog comfort is een extra troef! Beide kleuren in winkel.
https://www.coureurlocal.be/wp-content/uploads/2021/12/langa-advanced-pro-disc-1-300x300.png;Racefiets;Liv Langma Advanced Pro Disc 1;4 399,00;De Liv Langma Advanced Pro Disc heeft een nieuw ontworpen lichtgewicht aerodynamisch frame en een geheel nieuw wheelsysteem met geïntegreerde schijfremmen en hookless velgen.
https://www.coureurlocal.be/wp-content/uploads/2021/12/tcr-advanced-pro-disc-1-ut-300x300.png;Racefiets;Giant TCR Advanced Pro Disc 1 UT;4 399,00;In het klimmen, sturen en dalen ervaar je de ongeëvenaarde prestaties van de Giant TCR Advanced Pro Disc. Dit model brengt het fietsen in zowel de bergen als op het vlakke naar een hoger niveau dankzij het lichte, stijve frame en de aero-vormige buizen.
https://www.coureurlocal.be/wp-content/uploads/2021/12/tcr-advanced-disc-0-300x300.png;Racefiets;Giant TCR Advanced Disc 0;4 299,00;Trainen, koersen, tot het uiterste gaan. Of je nu demarreert of alles geeft om je persoonlijke records te verbeteren, de nieuwe Giant TCR Advanced Disc is de ideale fiets.
https://www.coureurlocal.be/wp-content/uploads/2022/12/brava-advanced-pro-1-300x300.png;Gravel, Cross, Adventure;Liv Brava Advanced Pro 1;4 299,00;De Liv Brava Advanced Pro is een wendbare crossfiets die garant staat voor uitzonderlijk rijgedrag en maximale acceleratie. Deze crossfiets is ontworpen om te presteren op het allerhoogste niveau.
https://www.coureurlocal.be/wp-content/uploads/2019/09/ferre-300x300.png;E-bike;Achielle Ferre;4 265,00;Necessary cookies are absolutely essential for the website to function properly. This category only includes cookies that ensures basic functionalities and security features of the website. These cookies do not store any personal information.
https://www.coureurlocal.be/wp-content/uploads/2019/01/MD11-300x300.png;E-bike;QWIC Performance MD11 Diamond;3 799,00;De QWIC Performance MD11 is een sportieve en luxe e-bike die perfect is voor een heuvelachtige omgeving.
https://www.coureurlocal.be/wp-content/uploads/2019/01/MD11-trapez-300x300.png;E-bike;QWIC Performance MD11 Trapez;3 799,00;De QWIC Performance MD11 is een sportieve en luxe e-bike die perfect is voor een heuvelachtige omgeving.
https://www.coureurlocal.be/wp-content/uploads/2021/12/revolt-advanced-0-300x300.png;Gravel, Cross, Adventure;Giant Revolt Advanced 0;4 199,00;Waar je ook wilt rijden, deze gravelbike kan het allemaal aan! De Giant Revolt Advanced is functioneler dan ooit dankzij zijn nieuwe carbon frameset en verstelbare wielbasis.
https://www.coureurlocal.be/wp-content/uploads/2021/12/tcx-advanced-pro-1-300x300.png;Gravel, Cross, Adventure;Giant TCX Advanced Pro 1;4 199,00;Snelle starts, krappe bochten, efficiëntie en controle in modder, zand en sneeuw. Bewezen door cyclocross pros is de nieuwste Giant generatie TCX  Advanced Pro gemaakt om te winnen.
https://www.coureurlocal.be/wp-content/uploads/2023/01/mira-daily-sage-green-300x300.png;E-bike;QWIC Mira Daily;3 699,00;De QWIC Mira Daily is de ideale e-bike voor een actieve levensstijl. Wat er ook op je programma staat, met deze veelzijdige e-bike kom je elke dag met veel genot en stijl door.
https://www.coureurlocal.be/wp-content/uploads/2022/05/Achielle-Esmee-300x300.png;E-bike;Achielle Esmee;4 104,00;De Achielle Esmee is een mooie en elegante elektrische fiets met Shimano Steps Middenmotor. De Esmee geeft een goede ondersteuning en een groot bereik. De Achielle Esmee is beschikbaar in verschillende kleuren, vanaf € 3280. Je kan alle kleuren zien bij Coureur Local.
https://www.coureurlocal.be/wp-content/uploads/2021/11/trance-x-29-1-300x300.png;Mountainbike;Giant Trance X 29 1;4 099,00;Vette rock gardens, lastige worteltapijten en steile, technische beklimmingen. De Giant Trance X 29 is voor rijders die de moeilijkste trailsecties als het favoriete deel van hun rit beschouwen. Met meer veerweg en een verstelbare geometrie levert deze aluminium trail-slayer puur, hardcore singletrack-plezier.
https://www.coureurlocal.be/wp-content/uploads/2020/11/Explore-E-1-pro-heer-300x300.png;E-bike;Giant Explore E+ 1 Pro;4 099,00;De Giant Explore E+ heeft een ALUXX aluminium frame en een SyncDrive Sport motor. Samengevoegd biedt dat geweldige stuureigenschappen en een soepele acceleratie op diverse soorten wegdek. De bredere tubeless banden zorgen voor comfort en stabiliteit. De geïntegreerde accu heeft een vermogen van 625 Wh.
https://www.coureurlocal.be/wp-content/uploads/2021/12/explore-E-1-pro-stagger-300x300.png;E-bike;Giant Explore E+ 1 Pro;4 099,00;De Giant Explore E+ heeft een ALUXX aluminium frame en een SyncDrive Sport motor. Samengevoegd biedt dat geweldige stuureigenschappen en een soepele acceleratie op diverse soorten wegdek. De bredere tubeless banden zorgen voor comfort en stabiliteit. De geïntegreerde accu heeft een vermogen van 625 Wh.
https://www.coureurlocal.be/wp-content/uploads/2022/03/allure-E-1-rosewood-300x300.png;E-bike;Liv Allure E+ 1;3 999,00;De Live Allure E+ combineert comfort en genot. Deze elegante e-bike heeft een lage instap, een ‘rechtop’ rijpositie en brede banden.
https://www.coureurlocal.be/wp-content/uploads/2021/11/defy-advanced-pro-2-UT-300x300.png;Racefiets;Giant Defy Advanced pro 2 Ultegra;3 999,00;Necessary cookies are absolutely essential for the website to function properly. This category only includes cookies that ensures basic functionalities and security features of the website. These cookies do not store any personal information.
https://www.coureurlocal.be/wp-content/uploads/2020/11/Explore-E-1-pro-45-heer-300x300.png;Elektrisch;Giant Explore E+ 1 Pro 45km/u;4 999,00;Necessary cookies are absolutely essential for the website to function properly. This category only includes cookies that ensures basic functionalities and security features of the website. These cookies do not store any personal information.
https://www.coureurlocal.be/wp-content/uploads/2020/11/Explore-E-1-pro-45-300x300.png;Elektrisch;Giant Explore E+ 1 Pro 45 km/u;4 999,00;Necessary cookies are absolutely essential for the website to function properly. This category only includes cookies that ensures basic functionalities and security features of the website. These cookies do not store any personal information.
https://www.coureurlocal.be/wp-content/uploads/2021/12/avail-advanced-pro-2-300x300.png;Racefiets;Liv Avail Advanced Pro 2;3 999,00;De Liv Avail Advanced is licht, comfortabel en specifiek ontworpen voor dames.
https://www.coureurlocal.be/wp-content/uploads/2021/11/Fathom-E-2-Pro-300x300.png;E-Mountainbike;Giant Fathom E+ 2 Pro;3 899,00;Neem de controle over de trails met deze vette, nieuwe hardtail e-bike. Nu kan je gemakkelijker klimmen en verder rijden, de perfecte formule voor een machtige dag op de trails.
https://www.coureurlocal.be/wp-content/uploads/2023/01/dailytour-E-1-bd-dames-metalic-navy-300x300.png;E-bike;Giant Dailytour E+ 1 BD;3 849,00;Met de geïntegreerde accu, onderhoudsvriendelijke riem, automatische ondersteuning en luxe kleurendisplay is het zalig om met de Giant DailyTour E+ op pad te gaan. De veelzijdige en praktische e-bike is ideaal voor dagelijks gebruik en voor langere fietstochten.
https://www.coureurlocal.be/wp-content/uploads/2023/01/dailytour-E-1-bd-heren-300x300.png;E-bike;Giant Dailytour E+ 1 BD;3 849,00;Met de geïntegreerde accu, onderhoudsvriendelijke riem, automatische ondersteuning en luxe kleurendisplay is het zalig om met de Giant DailyTour E+ op pad te gaan. De veelzijdige en praktische e-bike is ideaal voor dagelijks gebruik en voor langere fietstochten.
https://www.coureurlocal.be/wp-content/uploads/2020/03/mn7-belt-bruin-vr-300x300.png;E-bike;QWIC Premium i MN7+ Belt;3 549,00;De QWIC Premium i MN7+ Belt is de meest luxueuze van de Qwic Premium i reeks. Hij is uitgerust met een krachtige middenmotor. Deze e-bike beschikt over een carbon riemaandrijving. De Shimano Nexus 7 naafversnelling zorgt voor het grootste gemak. De e-bike is verkrijgbaar in verschillende maten.
https://www.coureurlocal.be/wp-content/uploads/2020/03/mn7-belt-bruin-man-300x300.png;E-bike;QWIC Premium i MN7+ Belt;3 549,00;De QWIC Premium i MN7+ Belt is de meest luxueuze van de Qwic Premium i reeks. Hij is uitgerust met een krachtige middenmotor. Deze e-bike beschikt over een carbon riemaandrijving. De Shimano Nexus 7 naafversnelling zorgt voor het grootste gemak. De e-bike is verkrijgbaar in verschillende maten.
https://www.coureurlocal.be/wp-content/uploads/2023/01/Fastroad-300x300.png;E-bike;Giant Fastroad E+;3 799,00;De Giant Fastroad E+ is een ultramoderne e-bike voorzien van een krachtige motor, een soepel rijdend frame en accessoires die hem perfect maken voor woon-werkverkeer of ander stedelijk verkeer.
https://www.coureurlocal.be/wp-content/uploads/2023/01/achielle-jean-300x300.png;E-bike;Achielle Jean Longtail;3 795,00;De Achielle Jean Longtail is een compacte 24″ e-bike die toch in staat is grote transporten te doen. Denk maar aan twee kinderen (met of zonder kinderstoelen), heel wat boodschappen, boekentassen… Jij kiest zelf de kleuren en alle andere opties. Via de configurator van Achielle kan je alle mogelijkheden bekijken. Maarten helpt je graag verder om de voor jou perfecte bakfiets samen te stellen. Twijfel je over de kleur? Je kan alle kleuren zien bij Coureur Local.
https://www.coureurlocal.be/wp-content/uploads/2023/01/dailytour-E-1-bd-heren-300x300.png;E-bike;Giant Dailytour E+ 1 BD Dash;3 699,00;Met de geïntegreerde accu, onderhoudsvriendelijke riem, automatische ondersteuning en luxe kleurendisplay is het zalig om met de Giant DailyTour E+ op pad te gaan. De veelzijdige en praktische e-bike is ideaal voor dagelijks gebruik en voor langere fietstochten.
https://www.coureurlocal.be/wp-content/uploads/2023/01/dailytour-E-1-bd-dames-metalic-navy-300x300.png;E-bike;Giant Dailytour E+ 1 BD Dash;3 699,00;Met de geïntegreerde accu, onderhoudsvriendelijke riem, automatische ondersteuning en luxe kleurendisplay is het zalig om met de Giant DailyTour E+ op pad te gaan. De veelzijdige en praktische e-bike is ideaal voor dagelijks gebruik en voor langere fietstochten.
https://www.coureurlocal.be/wp-content/uploads/2023/01/dailytour-E2-D-dame-300x300.png;E-bike;Giant Dailytour E+ 2 D;3 699,00;Met de geïntegreerde accu, automatische ondersteuning en luxe kleurendisplay is het zalig om met de Giant DailyTour E+ op pad te gaan. De veelzijdige en praktische e-bike is ideaal voor dagelijks gebruik en voor langere fietstochten.
https://www.coureurlocal.be/wp-content/uploads/2023/01/dailytour-E-2-d-heren-300x300.png;E-bike;Giant Dailytour E+ 2 D;3 699,00;Met de geïntegreerde accu, automatische ondersteuning en luxe kleurendisplay is het zalig om met de Giant DailyTour E+ op pad te gaan. De veelzijdige en praktische e-bike is ideaal voor dagelijks gebruik en voor langere fietstochten.
https://www.coureurlocal.be/wp-content/uploads/2023/01/dailytour-E-2-d-heren-300x300.png;E-bike;Giant Dailytour E+ 2 D Dash;3 599,00;Met de geïntegreerde accu, automatische ondersteuning en luxe kleurendisplay is het zalig om met de Giant DailyTour E+ op pad te gaan. De veelzijdige en praktische e-bike is ideaal voor dagelijks gebruik en voor langere fietstochten.
https://www.coureurlocal.be/wp-content/uploads/2023/01/dailytour-E2-D-dame-300x300.png;E-bike;Giant Dailytour E+ 2 D Dash;3 599,00;Met de geïntegreerde accu, automatische ondersteuning en luxe kleurendisplay is het zalig om met de Giant DailyTour E+ op pad te gaan. De veelzijdige en praktische e-bike is ideaal voor dagelijks gebruik en voor langere fietstochten.
https://www.coureurlocal.be/wp-content/uploads/2023/01/dailytour-E-1-heren-300x300.png;E-bike;Giant Dailytour E+ 1;3 599,00;Met de geïntegreerde accu, automatische ondersteuning en luxe kleurendisplay is het zalig om met de Giant DailyTour E+ op pad te gaan. De veelzijdige en praktische e-bike is ideaal voor dagelijks gebruik en voor langere fietstochten.
https://www.coureurlocal.be/wp-content/uploads/2023/01/dailytour-E-1-dames-300x300.png;E-bike;Giant Dailytour E+ 1;3 599,00;Met de geïntegreerde accu, automatische ondersteuning en luxe kleurendisplay is het zalig om met de Giant DailyTour E+ op pad te gaan. De veelzijdige en praktische e-bike is ideaal voor dagelijks gebruik en voor langere fietstochten.
https://www.coureurlocal.be/wp-content/uploads/2020/11/explore-E-1-heer-300x300.png;E-bike;Giant Explore E+ 1 625 Wh;3 599,00;De Giant Explore E+ heeft een ALUXX aluminium frame en een SyncDrive Sport motor. Samengevoegd biedt dat geweldige stuureigenschappen en een soepele acceleratie op diverse soorten wegdek. De bredere tubeless banden zorgen voor comfort en stabiliteit. De geïntegreerde accu heeft een vermogen van 625 Wh.
https://www.coureurlocal.be/wp-content/uploads/2020/11/explore-E-1-300x300.png;E-bike;Giant Explore E+ 1 625 Wh;3 599,00;De Giant Explore E+ heeft een ALUXX aluminium frame en een SyncDrive Sport motor. Samengevoegd biedt dat geweldige stuureigenschappen en een soepele acceleratie op diverse soorten wegdek. De bredere tubeless banden zorgen voor comfort en stabiliteit. De geïntegreerde accu heeft een vermogen van 625 Wh.
https://www.coureurlocal.be/wp-content/uploads/2021/12/dailytour-E-2-BD-panther-heer-300x300.png;E-bike;Giant Dailytour E+ 2 BD;3 549,00;Met de geïntegreerde accu, onderhoudsvriendelijke riem, automatische ondersteuning en luxe kleurendisplay is het zalig om met de Giant DailyTour E+ op pad te gaan. De veelzijdige en praktische e-bike is ideaal voor dagelijks gebruik en voor langere fietstochten.
https://www.coureurlocal.be/wp-content/uploads/2021/12/dailytour-E-2-BD-indigo-300x300.png;E-bike;Giant Dailytour E+ 2 BD;3 549,00;Met de geïntegreerde accu, onderhoudsvriendelijke riem, automatische ondersteuning en luxe kleurendisplay is het zalig om met de Giant DailyTour E+ op pad te gaan. De veelzijdige en praktische e-bike is ideaal voor dagelijks gebruik en voor langere fietstochten.
