Afbeeldingen;Categorieën;Naam;Prijs;Beschrijving
https://www.coureurlocal.be/wp-content/uploads/2021/01/storm-22-300x300.png;Kinderen;Storm 26″;289,00;Necessary cookies are absolutely essential for the website to function properly. This category only includes cookies that ensures basic functionalities and security features of the website. These cookies do not store any personal information.
https://www.coureurlocal.be/wp-content/uploads/2022/03/cedric-24-zw-300x300.png;Kinderen;Cedric 24″;269,00;Necessary cookies are absolutely essential for the website to function properly. This category only includes cookies that ensures basic functionalities and security features of the website. These cookies do not store any personal information.
https://www.coureurlocal.be/wp-content/uploads/2021/01/rock-zwart-300x300.png;Kinderen;Rock BMX 20″;269,00;Necessary cookies are absolutely essential for the website to function properly. This category only includes cookies that ensures basic functionalities and security features of the website. These cookies do not store any personal information.
https://www.coureurlocal.be/wp-content/uploads/2019/12/hondenkar-klein-300x300.png;Accessoires;Hondenkar klein;269,00;"Deze mini hondenkar is ombouwbaar naar een buggy, speciaal voor hondenvervoer. Met verstevigd stalen kader. Opvouwbaar.
Max. laadgewicht: 15 kg"
https://www.coureurlocal.be/wp-content/uploads/2021/01/kick-300x300.png;Kinderen;Kick BMX 20″;265,00;Necessary cookies are absolutely essential for the website to function properly. This category only includes cookies that ensures basic functionalities and security features of the website. These cookies do not store any personal information.
https://www.coureurlocal.be/wp-content/uploads/2021/01/celine-blauw-300x300.png;Kinderen;Celine 24″;265,00;Necessary cookies are absolutely essential for the website to function properly. This category only includes cookies that ensures basic functionalities and security features of the website. These cookies do not store any personal information.
https://www.coureurlocal.be/wp-content/uploads/2019/06/Cyclo-215-1-300x300.png;Fietsnavigatie;Mio Cyclo 215 HC;260,00;Necessary cookies are absolutely essential for the website to function properly. This category only includes cookies that ensures basic functionalities and security features of the website. These cookies do not store any personal information.
https://www.coureurlocal.be/wp-content/uploads/2022/03/cedric-20-300x300.png;Kinderen;Cedric 20″;249,00;Necessary cookies are absolutely essential for the website to function properly. This category only includes cookies that ensures basic functionalities and security features of the website. These cookies do not store any personal information.
https://www.coureurlocal.be/wp-content/uploads/2021/01/volt-20-300x300.png;Kinderen;Volt 20″;249,00;Necessary cookies are absolutely essential for the website to function properly. This category only includes cookies that ensures basic functionalities and security features of the website. These cookies do not store any personal information.
https://www.coureurlocal.be/wp-content/uploads/2021/01/celine-roos-300x300.png;Kinderen;Celine 20″;239,00;Necessary cookies are absolutely essential for the website to function properly. This category only includes cookies that ensures basic functionalities and security features of the website. These cookies do not store any personal information.
https://www.coureurlocal.be/wp-content/uploads/2019/12/mariposa-16-300x300.png;Eerste Fietsjes;Mariposa 16″;239,00;Necessary cookies are absolutely essential for the website to function properly. This category only includes cookies that ensures basic functionalities and security features of the website. These cookies do not store any personal information.
https://www.coureurlocal.be/wp-content/uploads/2021/01/volt-18-300x300.png;Eerste Fietsjes;Volt 18″;239,00;Necessary cookies are absolutely essential for the website to function properly. This category only includes cookies that ensures basic functionalities and security features of the website. These cookies do not store any personal information.
https://www.coureurlocal.be/wp-content/uploads/2020/04/Garmin-edge-520-plus-300x300.png;Fietsnavigatie;Garmin Edge 520 Plus;230,00;Met Garmin Edge 520 Plus kan je slimmer trainen en nieuwe routes ontdekken. Deze fietscomputer beschikt over geïntegreerde, geavanceerde navigatie en uitdagingen, een helder kleurenscherm, vooraf geladen Strava Live Segments en de Garmin fietskaart met gesproken afslag-voor-afslag aanwijzingen.
https://www.coureurlocal.be/wp-content/uploads/2019/01/Baffie-12-300x300.png;Eerste Fietsjes;Baffy 14″;229,00;Necessary cookies are absolutely essential for the website to function properly. This category only includes cookies that ensures basic functionalities and security features of the website. These cookies do not store any personal information.
https://www.coureurlocal.be/wp-content/uploads/2019/01/Baffie-12-300x300.png;Eerste Fietsjes;Baffy 12″;225,00;Necessary cookies are absolutely essential for the website to function properly. This category only includes cookies that ensures basic functionalities and security features of the website. These cookies do not store any personal information.
https://www.coureurlocal.be/wp-content/uploads/2021/01/kick-300x300.png;Eerste Fietsjes;Kick BMX 18″;215,00;Necessary cookies are absolutely essential for the website to function properly. This category only includes cookies that ensures basic functionalities and security features of the website. These cookies do not store any personal information.
https://www.coureurlocal.be/wp-content/uploads/2020/11/giant-charge-elite-gray-black-300x300.png;Giant Gear, Fietskledij;Giant Charge Elite mountainbike schoenen;200,00;Necessary cookies are absolutely essential for the website to function properly. This category only includes cookies that ensures basic functionalities and security features of the website. These cookies do not store any personal information.
https://www.coureurlocal.be/wp-content/uploads/2019/06/Cyclo-215-300x300.png;Fietsnavigatie;Mio Cyclo 210;200,00;HC = hartslagmeter
https://www.coureurlocal.be/wp-content/uploads/2019/02/gamechanger-blauw-300x300.png;Accessoires;Helm Abus Aero-helm GameChanger;200,00;De Abus GameChanger is de ultieme aero helm voor zij die de allerhoogste eisen stellen, zoals profwielrenners. Aerodynamica opnieuw gedefinieerd. De unieke stromingspatronen zijn ontwikkeld in nauw overleg met de profs van het Movistar Team met als doel de natuurlijke vijand van de wielrenner, de tegenwind, te verslaan
https://www.coureurlocal.be/wp-content/uploads/2019/02/Abus-Pedelec-Ace-2.0-300x300.png;Accessoires;Helm Abus Pedelec 2.0 Ace;200,00;Necessary cookies are absolutely essential for the website to function properly. This category only includes cookies that ensures basic functionalities and security features of the website. These cookies do not store any personal information.
https://www.coureurlocal.be/wp-content/uploads/2021/01/volt-16-300x300.png;Eerste Fietsjes;Volt 16″;199,00;Necessary cookies are absolutely essential for the website to function properly. This category only includes cookies that ensures basic functionalities and security features of the website. These cookies do not store any personal information.
https://www.coureurlocal.be/wp-content/uploads/2021/01/kick-300x300.png;Eerste Fietsjes;Kick BMX 16″;199,00;Necessary cookies are absolutely essential for the website to function properly. This category only includes cookies that ensures basic functionalities and security features of the website. These cookies do not store any personal information.
https://www.coureurlocal.be/wp-content/uploads/2021/01/coureur-local-lucca-winterjas-300x300.png;Giant Gear, Fietskledij;Lucca winterjas Coureur Local;160,00;De Lucca winterjas is niet alleen luxueus en stijlvol. Hij is ook waterdicht en zeer ademend zodat je droog blijft in de meest uiteenlopende temperaturen en omstandigheden. Het is van hoogwaardige kwaliteit, merk Bodhi. Korting voor teamleden.
https://www.coureurlocal.be/wp-content/uploads/2019/09/Odette-op-grassy-green-300x300.jpg;Eerste Fietsjes;Foxrider;159,00;De klassieke driewieler werd heruitgevonden met een retro touch. De foxrider is verkrijgbaar in Vintage Blue, Vintage Pink, Black, White, Grassy Green, Sunny Yellow en (nieuwe kleur!) Rosy Red.
https://www.coureurlocal.be/wp-content/uploads/2020/11/giant-comp-zwart-300x300.png;Giant Gear, Fietskledij;Giant Surge Comp raceschoenen;150,00;De nieuwe Giant Surge comp raceschoenen hebben een iets comfortabeler pasvorm, betere prestaties op beklimmingen, in de sprint of het verleggen van je grenzen tijdens lange ritten op de weg. Dat is wat je kunt verwachten van de nieuwe Surge Comp. De Giant Dynamic Cycling Fit combineert onze MES met een QuickFit bovenwerk voor een onverslaanbaar comfort, krachtoverdracht en prestaties.
https://www.coureurlocal.be/wp-content/uploads/2020/11/liv-macha-zwart-300x300.png;Giant Gear, Fietskledij;Liv Macha raceschoenen;150,00;"Deze Liv Macha raceschoenen hebben volgende eigenschappen:



Injection molded TPU elements in both heel and toe help protect the nylon composite ExoBeamTM plate from wear while off the bike
Liv’s Motion Efficiency System nylon composite outsole (30% glass fiber, 70% nylon) —keeps the forefoot stiff while enabling torsional movement of the rear and mid foot
Specially developed last increases motion efficiency and relaxed fit
Highest quality upper material offers excellent support, comfort and ventilation at extremely low weight
On-the-fly micro-adjustment Boa® Fit System integrated with ExoWrapTM technology offers unsurpassed fit and support
Breathable TransTextura PlusTM sockliner lets heat escape and keeps feet feeling fresh"
https://www.coureurlocal.be/wp-content/uploads/2020/11/stormchaser-flipflop-purple-300x300.png;Accessoires;Helm Abus Stormchaser;150,00;De Abus StormChaser past met zijn eigenschappen bij elke race: van wegwedstrijden en cyclocross tot ambitieuze wedstrijden. De helm weegt weinig, is uiterst comfortabel, uitstekend geventileerd en verkrijgbaar in vele moderne kleuren.
https://www.coureurlocal.be/wp-content/uploads/2020/08/groepsfoto-coureur-local-300x300.png;Giant Gear, Fietskledij;Fietstenue Coureur Local;150,00;Het fietstenue van Coureur Local bestaat uit een Golden Eye shirt en een Black Eye luxe broek. Het is van hoogwaardige kwaliteit, merk Bodhi. Korting voor teamleden.
https://www.coureurlocal.be/wp-content/uploads/2021/02/giant-pre-oranje-300x300.png;Eerste Fietsjes;Giant loopfiets;150,00;Deze Giant Pre push bike is een kwalitatieve loopfiets. Deze Giant Pre is de start van vele avonturen op twee wielen! Lichtgewicht! 12″
https://www.coureurlocal.be/wp-content/uploads/2020/04/thule-yepp-nexxt-maxi-zwart-300x300.png;Accessoires;Thule Yepp Nexxt Maxi;150,00;De Thule Yepp Nexxt Maxi is een licht en veilig fietszitje, voor montage op de bagagedrager, met een eigentijds ontwerp dat hoogwaardig comfort voor je kind biedt.
https://www.coureurlocal.be/wp-content/uploads/2019/02/pedelec-2.0-zwart-300x300.png;Accessoires;Helm Abus Pedelec 2.0;140,00;Met de Pedelec 2.0 biedt Abus een fietshelm die voldoet aan de hoge veiligheidseisen. Met zijn diepe slaap- en nekbescherming en het heldere, oplaadbare achterlicht biedt de helm extra veiligheid.
https://www.coureurlocal.be/wp-content/uploads/2020/11/aventor-zwart-300x300.png;Accessoires;Helm Abus Aventor;130,00;De Abus Aventor is de ideale bescherming voor je hoofd tijdens sportprestaties op de fiets. Hij zorgt voor voldoende ventilatie met 3 luchtin- en 7 luchtuitgangen.
https://www.coureurlocal.be/wp-content/uploads/2020/01/B-safe-300x300.png;Accessoires;Fietsrugzak Basil B-Safe Backpack Nordlicht;130,00;"De Basil B-Safe Backpack Nordlicht is een moderne rugzak met allerlei slimme functies. Inclusief waterdichte regenhoes ter bescherming van je spullen. De LED-verlichting aan de voorzijde van de tas (Nordlicht Technology) zorgt voor extra veiligheid.

Volume: 18 l"
https://www.coureurlocal.be/wp-content/uploads/2021/04/thule-yepp-nexxt-mini-mint-green.JPG-300x300.png;Accessoires;Thule Yepp Nexxt Mini;130,00;De Thule Yepp Nexxt Mini is een licht en stijlvol fietszitje, voor montage aan het stuur, met slim ontwerp. Zet je kind zeer snel, gemakkelijk en handig vast met de magnetische kindveilige gesp
https://www.coureurlocal.be/wp-content/uploads/2020/11/recon-HL-1800-300x300.png;Giant Gear, Fietskledij;Giant Recon HL 1800;120,00;"Smart Mode light sensor monitors ambient light to adjust light output accordingly
Pairs with Garmin series computers via ANT+ to see battery information and light mode on screen (HL1800 only) 
ANSI certified lumens and run time
Focused optics with side light design for over 270-degrees of visibility
Heat-dissipating CNC-machined aluminum casing
Power status indicator alerts remaining run-time before powering off
Includes adjustable GoPro mount"
https://www.coureurlocal.be/wp-content/uploads/2022/03/volare-autoped-zw-ro-16-300x300.png;Kinderen;Volare autoped;115,00;Volare autoped 16 inch
https://www.coureurlocal.be/wp-content/uploads/2022/03/volare-autoped-16-300x300.png;Kinderen;Volare autoped;115,00;Volare autoped 16 inch
https://www.coureurlocal.be/wp-content/uploads/2021/01/coureur-local-broek-lang-300x300.png;Giant Gear, Fietskledij;Broek lang Coureur Local;110,00;De 4-way stretch stoffen bieden ademend vermogen en een dynamisch bewegingsbereik, ideaal voor de koudere maanden van het jaar. Onderaan is er een rits voor het gebruiksgemak. Het is van hoogwaardige kwaliteit, merk Bodhi. Korting voor teamleden.
https://www.coureurlocal.be/wp-content/uploads/2020/10/basil-soho-300x300.png;Accessoires;Fietsrugzak Basil SoHo Nordlicht;110,00;"De Basil SoHo fietsrugzak Nordlicht is een moderne rugzak speciaal uitgerust voor woon-werkverkeer. De tas is volledig waterdicht.
Volume: 17 l"
https://www.coureurlocal.be/wp-content/uploads/2020/11/giant-transmit-300x300.png;Giant Gear, Fietskledij;Giant Transmit mountainbike schoenen;100,00;"De Giant Transmit mountainbike schoenen hebben volgende eigenschappen:
 

Fully integrated nylon/glass fiber MES ExoBeam midsole plate combines pedaling stiffness with flexibility for increased comfort, and stability on rough trails
High traction, one-piece rubber sole for maximum grip on slippery terrain
New ratchet buckle with rock shield and two injected hook-and-loop straps for easy on-the-fly adjustments
Reversed front strap for improved comfort
Reinforced toecap for added protection"
https://www.coureurlocal.be/wp-content/uploads/2020/11/giant-Phase-2-schoenen-300x300.png;Giant Gear, Fietskledij;Giant Phase 2 raceschoenen;100,00;De nieuwe Giant Phase 2 raceschoenen zorgen met de combinatie van de ForceDrive nylon zool en het QuickFit systeem voor een optimale efficientie en comfort.
https://www.coureurlocal.be/wp-content/uploads/2020/01/urban-dry-300x300.png;Accessoires;Fietsrugzak Basil Urban Dry Backpack;100,00;"De Basil Urban Dry fietsrugzak is een rugzak en fietstas in één! Deze zwarte rugtas is 100% waterdicht en bevestig je met het Hook-On systeem eenvoudig aan je bagagedrager (ook E-bikes).
Volume: 18 l"
https://www.coureurlocal.be/wp-content/uploads/2021/01/coureur-local-shirt-lange-mouw-300x300.png;Giant Gear, Fietskledij;Shirt lang Coureur Local;95,00;Black Eye shirt lange mouw, ideaal voor (late) herfst en vroege lente. Het is van hoogwaardige kwaliteit, merk Bodhi.
https://www.coureurlocal.be/wp-content/uploads/2019/01/fietstas-monte-grappa-300x300.png;Accessoires;Dubbele fietstas Monte Grappa;95,00;Necessary cookies are absolutely essential for the website to function properly. This category only includes cookies that ensures basic functionalities and security features of the website. These cookies do not store any personal information.
https://www.coureurlocal.be/wp-content/uploads/2020/11/urban-I-3.0-jade-green-300x300.png;Accessoires;Helm Arbus Urban-I 3.0;90,00;Necessary cookies are absolutely essential for the website to function properly. This category only includes cookies that ensures basic functionalities and security features of the website. These cookies do not store any personal information.
https://www.coureurlocal.be/wp-content/uploads/2020/04/viantor-wit-300x300.png;Accessoires;Helm Abus Viantor;90,00;Voor een hoge mate van veiligheid beschikt de Abus Viantor over de in het EPS geïntegreerde ActiCage-structuurversterking. Dit biedt de drager een maximale bescherming bij optimale ventilatie en het hoogste comfort. Met de ActiCage kunnen ventilatieopeningen in de helm groot uitvallen, zonder dat de helm de noodzakelijke veiligheid verliest.
https://www.coureurlocal.be/wp-content/uploads/2020/01/miles-daypack-nordlicht-300x300.png;Accessoires;Fietsrugzak Basil Miles Daypack Nordlicht;90,00;"De Basil Miles Daypack is een waterdichte fietstas voor achterop met Hook-On System, reflectiedetails en binnenvoering. Je gebruikt de tas als fietstas, maar ook als schoudertas of rugzak. De LED-verlichting aan de voorzijde van de tas (Nordlicht Technology) zorgt voor extra veiligheid.

Volume: 17 l"
https://www.coureurlocal.be/wp-content/uploads/2019/04/miles1-300x300.png;Accessoires;Fietstas Basil dubbele tas Miles;90,00;"De Basil Miles Double Bag is een dubbele fietstas voor een dames- of herenfiets. De fietstassen zijn niet alleen stijlvol, maar beschikken ook over een sportieve uitstraling.
Volume: 17 x 2 = 34 l"
https://www.coureurlocal.be/wp-content/uploads/2020/03/step-grafitti-300x300.png;Kinderen;Stuntstep JD Bug TC 119;89,00;"Deze step / stuntscooter is het perfecte cadeau voor sportieve types die van actie houden en graag buiten zijn. Ideaal voor op het skatepark of gewoon voor op straat. Voetrem op achterwiel. Vast en versterkt aluminium stuur
Aanbevolen vanaf 7 jaar."
https://www.coureurlocal.be/wp-content/uploads/2019/06/Basil-Miles-300x300.png;Accessoires;Bagagedragertas Basil Miles Trunkbag MIK;85,00;De Basil Miles Trunkbag is een sportieve bagagedragertas voor zowel mannen als vrouwen. Met de voorgemonteerde MIK-adapterplaat bevestig je in 1 seconde je trunkbag op je MIK-bagagedrager.De inhoud van de tas is 7 liter
https://www.coureurlocal.be/wp-content/uploads/2020/11/regalo-300x300.png;Giant Gear, Fietskledij;Liv Regalo raceschoenen;80,00;"Deze Liv Regalo raceschoenen hebben volgende eigenschappen:



ForceDriveTM nylon outsole gives entry to clipless pedal-level riders optimized stiffness for better power transfer
Streamlined tread keeps things light
Anti-slip studs in front, middle and rear of outsole provide enhanced walking ability
AIRSTREAMTM 4-vent Cooling System produce an airflow effect that works in conjunction with the honeycomb air mesh fiber on the upper, resulting in a complete cooling system
Last optimizes comfort and fit during on-road cycling
Three large Velcro straps provide easy, infinite adjustment
A two- or three-bolt cleat pattern fits any pedal style
Light TransTextura PlusTM anti-odor breathable sockliner
Air mesh tongue
Durable and breathable synthetic upper material with soft mesh collar and lining
SPD and SPD SL Cleat compatibility"
https://www.coureurlocal.be/wp-content/uploads/2020/11/youn-I-ace-rosé-gold-300x300.png;Accessoires;Helm Abus Youn-I ACE;75,00;Necessary cookies are absolutely essential for the website to function properly. This category only includes cookies that ensures basic functionalities and security features of the website. These cookies do not store any personal information.
https://www.coureurlocal.be/wp-content/uploads/2020/11/windbreaker-300x300.png;Giant Gear, Fietskledij;Windbreaker Coureur Local;75,00;De windbreaker van Coureur Local is een musthave voor elke wielrenner. Zijn trendy look, gecombineerd met mesh-rugpaneel voor een betere pasvorm en ademend vermogen, zorgen ervoor dat je dit dagelijks zal gebruiken in elk seizoen. De windbreaker heeft een speciaal ontworpen achterzak waarin je hem eenvoudig kan opbergen. Het is van hoogwaardige kwaliteit, merk Bodhi. Korting voor teamleden.
https://www.coureurlocal.be/wp-content/uploads/2019/09/basil-sport-design-300x300.jpg;Accessoires;Fietstas Basil dubbele tas Sport Design;75,00;"De Basil Sport Design is een dubbele fietstas voor achterop een dames- of herenfiets. De stijlvolle fietstassen zijn verkrijgbaar in het zwart.
Volume: 17 x 2 = 34 l"
https://www.coureurlocal.be/wp-content/uploads/2019/01/miles-daypack-bruin-grijs-300x300.png;Accessoires;Fietsrugzak Basil Miles Daypack;75,00;"De Basil Miles Daypack is een waterdichte fietstas voor achterop met Hook-On System, reflectiedetails en binnenvoering. Je gebruikt de tas als fietstas, maar ook als schoudertas of rugzak. De LED-verlichting aan de voorzijde van de tas (Nordlicht Technology) zorgt voor extra veiligheid.

Volume: 17 l"
https://www.coureurlocal.be/wp-content/uploads/2020/11/abus-aduro-2.0-metallic-copper-300x300.png;Accessoires;Helm Abus Aduro 2.0;70,00;De Abus Aduro 2.0 fietshelm van ABUS is de perfecte begeleider bij het fietsen door de stad. Veilig, individueel aanpasbaar en bijzonder comfortabel.
https://www.coureurlocal.be/wp-content/uploads/2020/11/recon-HL500-TL100-300x300.png;Giant Gear, Fietskledij;Giant Recon HL 500 & TL 100 combo;65,00;"Headlight:
Lumens and runtime certified to the ANSI-Standard
Focused optics with side light design for over 270 degrees visibility
Heat-dissipating CNC-machined aluminum structure
Power status indicator can let you know how much run-time to go before powering off
Includes adjustable GoPro mount

 

Tailight:
Maximum output to 100 lumens
ANSI-Standard certified lumen output and runtime
Water proof to IPX7 standard
Disperse optics with side light design for over 180-degrees of visibility
Power status indicator alerts remaining run-time before powering off
Light memory mode
Compatible with saddle rail mount, providing optimal angle for visibility"
https://www.coureurlocal.be/wp-content/uploads/2020/09/volare-blauw-300x300.png;Eerste Fietsjes;Volare loopfiets;65,00;Het Volare loopfietsje heeft 10” wieltjes en zachte rubberen handvatten. Het zadel is in hoogte verstelbaar. Een loopfiets helpt kinderen sneller hun evenwichtsgevoel te ontwikkelen. Vanaf 3 jaar. Verkrijgbaar in verschillende kleuren.
https://www.coureurlocal.be/wp-content/uploads/2019/06/Miles-trunkbag-300x300.png;Accessoires;Bagagedragertas Basil Miles Trunkbag;65,00;De Basil Miles Trunkbag is een bagagedragertas geschikt voor de echte sportievelingen onder ons. Door de handgrepen en afneembare schouderriem kun je de tas in de hand, maar ook als schoudertas dragen. De inhoud van de tas is 7 liter
https://www.coureurlocal.be/wp-content/uploads/2019/05/carry-all-bag-groen-300x300.png;Accessoires;Fietstas Basil Boheme Carry All Bag;65,00;Necessary cookies are absolutely essential for the website to function properly. This category only includes cookies that ensures basic functionalities and security features of the website. These cookies do not store any personal information.
https://www.coureurlocal.be/wp-content/uploads/2020/02/oprijgoot-300x300.png;Accessoires;Thule EasyFold XT oprijgoot;61,00;Handige, opvouwbare oprijgoot voor het eenvoudig laden en lossen van je (elektrische) fietsen. De oprijgoot kan worden geïntegreerd in de fietsendrager zodat hij gemakkelijk op te bergen is wanneer hij niet gebruikt wordt
https://www.coureurlocal.be/wp-content/uploads/2019/12/youn-i-neon-yellow-300x300.png;Accessoires;Kinderhelm Abus Youn-I Neon Yellow;60,00;"De Abus Youn-I scoort met het eenvoudige en modebewuste ontwerp en is speciaal ontwikkeld voor de jonge fietser. Verkrijgbaar in verschillende kleurencombinaties.
Verkrijgbaar in S (hoofdomtrek 48-54 cm) | M (hoofdomtrek 52-57 cm)"
https://www.coureurlocal.be/wp-content/uploads/2020/04/mount-z-300x300.png;Accessoires;Kinderhelm Abus MountZ;60,00;Necessary cookies are absolutely essential for the website to function properly. This category only includes cookies that ensures basic functionalities and security features of the website. These cookies do not store any personal information.
https://www.coureurlocal.be/wp-content/uploads/2019/02/youn-I-cherry-heart-300x300.png;Accessoires;Kinderhelm Abus Youn-I veelkleurig;60,00;De Abus Youn-I scoort met het eenvoudige en modebewuste ontwerp en is speciaal ontwikkeld voor de jonge fietser. Verkrijgbaar in verschillende kleurencombinaties.
https://www.coureurlocal.be/wp-content/uploads/2019/02/youn-I-sparkling-green-300x300.png;Accessoires;Kinderhelm Abus Youn-I effen;60,00;Necessary cookies are absolutely essential for the website to function properly. This category only includes cookies that ensures basic functionalities and security features of the website. These cookies do not store any personal information.
https://www.coureurlocal.be/wp-content/uploads/2019/02/abus-aduro-2.1-zilver-300x300.png;Accessoires;Helm Abus Aduro 2.1;60,00;De Aduro 2.1 is een sportieve helm voor dagelijks gebruik met een buitengewoon goed draagcomfort. De uitstekende ventilatie zorgt voor een aangenaam gevoel op de fiets. Keuze uit verschillende mooie kleuren!
https://www.coureurlocal.be/wp-content/uploads/2019/02/abus-aduro-2.1-300x300.png;Accessoires;Helm Abus Aduro 2.1;60,00;De Aduro 2.1 is een sportieve helm voor dagelijks gebruik met een buitengewoon goed draagcomfort. De uitstekende ventilatie zorgt voor een aangenaam gevoel op de fiets. Keuze uit verschillende mooie kleuren!
https://www.coureurlocal.be/wp-content/uploads/2019/01/mand-basil-300x300.png;Accessoires;Mand Basil Denton;45,00;Deze transportfietsmand past perfect op alle fietsen met een pakdrager vooraan. Boodschappen vervoeren is geen probleem meer voor jou!
